s_no,title
0,"Robbers target trucks with bombing attack"
1,"Swine flu patients deprived of treatment "
2,"Landslides obstruct in Panchthar road section"
3,"Ruling Nepali Congress cadres join protests against demarcation in Saptari "
4,"World shortest man,Nepal Chandra B Dangi dies at 75"
5,"Man hammers US lady to death, throws body into Seti River"
6,"Nepal Airlines rated world worst air carrier"
7,"Agitating Tharus to return citizenship certificates to state"
8,"RPP-N cadres register complaint at CIAA for irregularition structure"
9,"Swine flu detected in Bara village "
10,"Prices of daily essentials soar on shortages created by Tarai banda "
11,"Banda continues to affect life across Tarai "
12,"Protests on in Tarai; govt office, vehicle set on fire "
13,"Constable injured in clash dies "
14,"Mainapokhari tense after protests "
15,"Swine flu detected in Ramechhap patients "
16,"HIs health is worrying villagers "
17,"Prolonged strikes hit trade, business activities in West "
18,"Angry protestors torch govt officevehicle in Rajbiraj "
19,""Militants" killed in Kashmir battle "
20,"This powerful image of a dead Syrian child shocked the world "
21,"Normal life hit hard in Tarai as strike enters day; Rajbiraj completely shut "
22,"They visitors avoiding Pokhara due to strikes "
23,"Wholesalers ‘running out of food stocks’ "
24,"Writ filed against use of weapons, excessive force in Tarai protest "
25,"Violent clashes spread east to Janakpur, Biratnagar "
26,"Destroying authority remains ‘suspended’ "
27,"International Crisis Group issues "conflict alert" for #Nepal."
28,"Writ at SC against use of lethal weapons in protests "
29,"Four Red Cross ambulances have been vandalised in the ongoing Madhes unrest"
30,"Protests against federal model claims 23 lives so far"
31,"Landslides shoot up prices of essential commodities in Taplejung "
32,"Cooking gas ‘shortage’ starts to grip Kathmandu Valley "
33,"Single women ‘left without access to relief’ "
34,"Tharu men flee villages in wake of deadly Tikapur clash "
35,"5 die in clashes with police in Birgunj and Kalaiya, dozens hurt "
36,"Remittances hopes of a society traumatised by the devastating earthquake "
37,"Police lob water cannon to disperse Hindu activists "
38,"Police fires tear gas shells at protesters in Baneshwor "
39,"Birgunj riot: another four die in police firing,eight people injured "
40,"Kalaiya tense: one killed, 17 injured in firing "
41,"Four more protesters dead in Birgunj, Birgunj declared riot-hit area. "
42,"Birgunj remains tense: 5 more injured in police firing,protesters defy curfew "
43,"Ilam tea farmers hurt by fall in output,low prices "
44,"Police fires at protestors after curfew defied in Birgunj,2 kids injured "
45,"Relief materials meant for Dhading earthquake victims stuck in warehouse for the past two months "
46,"Govt yet to come up with meaningful bill on disaster management "
47,"Violent protest shifting towards centeral Tarai; One protestor dies of bullet wounds in Birgunj "
48,"Only three amendments were received by CA Secretariat by Monday evening "
49,"Depukhu Jatra: People hurl a live goat into pond and rip it apart (photo feature)"
50,"NC, UML discouraging their CA members from tabling amendments "
51,"Police fire shots as protestors defy prohibitory order in Kalaiya "
52,"Banda continues to cripple life in Tarai  "
53,"Activist for Mexico missing killed"
54,"Six children shot dead in Texas home"
55,"Bangladesh "tiger poachers" shot dead"
56,"They were killed in the home "
57,"Eleven dead in India temple stampede"
58,"NFL star and broadcaster Gifford dies"
59,"Eight dead in Texas home shooting"
60,"Huge hailstones shatter plane windscreen"
61,"Typhoon Soudelor were teared through China"
62,"Cancer survival "lagging in England""
63,"Anti-thalidomide hero dies at 101"
64,"Several dead as Mali siege ends"
65,"Rwanda soldier kills four colleagues"
66,"Million affected by Myanmar flooding"
67,"OSCE cars torched in eastern Ukraine"
68,"Migrant "chaos" on Greek islands - UN"
69,"Violence mars delayed Haiti poll"
70,"Rio Olympic water pollution protest"
71,"Israel holds more "Jewish radicals""
72,"US cinema gunman spared death penalty"
73,"Scores dead in blasts in eastern Iraq"
74,"Legionnaires" outbreak widens in NYC"
75,"They hit by the series of attacks"
76,"Hostage texted before Texas murders"
77,"Spill turns Colorado river yellow"
78,"Scars of China are scaring the organ trafficking trade"
79,"Leak are turning Colorado river yellow"
80,"Fleeing from Libya - eight months pregnant"
81,"Dancer Jonathan Ollivier dies in crash"
82,"Warming threat to UK butterflies"
83,"Anti-thalidomide hero dies at 101"
84,"Vandals killed Cecil the lion - Mugabe"
85,"Deadly bomb attack on Kabul airport"
86,"Two killed in Swedish Ikea attack"
87,"Parents leave girl by France highway"
88,"China black market for organ donations"
89,"The big business of trophy hunting in Iran"
90,"Asia stocks down as yuan again lower"
91,"Dozens missing in China landslide"
92,"Chaos on Kos amid migrants move"
93,"US officer fired over fatal shooting"
94,"California are firing 1000 homes evacuated"
95,""He is a victim of Syrian crisis""
96,"They are Scuffling in Kos over immigration papers"
97,"Libya annoucement of death sentences cast long shadow"
98,"Ukraine are banning 38 Russian "hate" books"
99,"They is making of a martyr a condolence"
100,"Nigeria market has blasted and killed 47""
101,"Dutch teen dies in Spain bungee jump"
102,"Azeri footballer held over killing"
103,"Activist for Mexico missing killed"
104,"Scores dead in blasts in eastern Iraq"
105,"Dozens held after Ferguson clashes"
106,"Massive blasts hit north China city"
107,"Jimmy Carter reveals he has cancer"
108,"Croatia fears for Egypt hostage"
109,"N Korea vice-premier "executed""
110,"Egypt heatwave leaves 61 people dead"
111,"Tear gas used on migrants in Kos"
112,"World reactions on yuan devaluation"
113,"Libya death sentences cast long shadow"
114,"He announces 2500 job cuts"
115,"They is making of a martyr a condolence"
116,"UN CAR envoy sacked amid abuse claims"
117,"Ukraine fighting violates truce - EU"
118,"he is cracking down on gangs"
119,"Ceasefires are starting in Syrian towns"
120,"Suspected IS chemical is attacking in the Iraq"
121,"Turkey polls loom as talks collapse"
122,"These are the Deafening sound of China explosions"
123,"They are Devastating inside the China blast zone"
124,"On the Buses" "Blakey" dies aged 88"
125,"Egypt policemen jailed over deaths"
126,"Death sentences over Peshawar attack"
127,"They were jailed two rights activists"
128,"Mexico nursery fire: Arrests ordered"
129,"Scores die in Baghdad truck bombing"
130,"Mountain lion killed in California"
131,"IS leader "raped" US hostage Mueller"
132,"Gunmen kill 18 in Brazil Sao Paulo"
133,"Man killed by rollercoaster in Ohio"
134,""A terrible episode of violence""
135,"Global "food shocks" risk increasing"
136,"They are battling to militias in Libya Sirte"
137,"Red Sox manager says he has cancer"
138,"Baghdad hit by new spate of bombs"
139,"Ex-Pakistan intelligence chief dies"
140,"The Migranting people die in boat hold off Libya"
141,"They are glitching grounds US flights"
142,"Ex-army chief was shot dead in Burundi"
143,"They are Migranting for "overcoming by diesel fumes""
144,"A manhole was explodes on busy street"
145,"A Gunmen guy was killed 18 in Brazil Sao Paulo"
146,"The leader "raped US hostage Mueller""
147,"They are battling militias in Libya Sirte"
148,"Red Sox manager says he has cancer"
149,"They are halting plants near Tianjin"
150,"Diabetes has cases soar 60% in a decade"
151,"The Migranting people die in boat hold off Libya"
152,"Ex-army chief was shot dead in Burundi"
153,"Suicide blast has killed Punjab minister"
154,"Syria market air strikes "kill 80""
155,"IS leader "raped US hostage Mueller""
156,"Bangkok bomb "targeted foreigners""
157,"US actor Emile Hirsch admits assault"
158,"UN "horrified" by Syria attacks"
159,"Probe into Mexico students "blocked""
160,"Batman impersonator dies in accident"
161,"Bomb blast at central Bangkok shrine"
162,"Bangkok eyewitnesses describe horror"
163,""Thrown to ground" in Bangkok blast"
164,"Smugglers help Yazidis escape IS"
165,"Eastern Ukraine violence mounting"
166,"The Diabetes has cases soar 60% in a decade"
167,"This taxi goes over bridge, hits train"
168,"They are Shelling in the east Ukraine kills nine"
169,"Spanish bulls has gore and leads seven to death"
170,"Smugglers are helping enslaved Yazidis to escape Islamic State"
171,"Bangkok are the bomber who bombed the part of network""
172,"Palmyra archaeologist was "killed by IS""
173,"Turkish troops has killed in bomb attack"
174,"Batgirl actress Yvonne Craig dies"
175,"Prisoner actress "assaulted girl""
176,""Dozens drown" fleeing Boko Haram"
177,"Rare Philippine eagle shot dead"
178,"Bolivia gold has clash turns deadly"
179,"Yemen got deaths "amount to war crimes""
180,"The death of a Russian revolutionary"
181,"Extra fencing and dogs for Calais"
182,"Country singer Lynn Anderson dies"
183,"Baghdad sees heatwave protests"
184,"Syria group eizes US-backed rebels""
185,"Putin "ordered Litvinenko killing""
186,"More people "disappearing" in Egypt"
187,"Eurozone inflation holds steady"
188,"Ashley Madison hack aids spammers"
189,"Studio collapse puts films in limbo"
190,"they has Terrored on the beach"
191,"Five killed in PKK attacks in Turkey"
192,"Fred, 22, tested positive - Brazil FA"
193,"US Good Samaritans killed by driver"
194,"Charleston gunman pleads not guilty"
195,"Ohio shooting: After the gun went off"
196,"IAAF files show "extent of cheating""
197,"Iraqi Kurds issue warning to PKK"
198,"Dozens die as rains lash SE Asia"
199,"Outburst mars Bobbi Brown memorial"
200,"Bitcoin chief arrested in Japan"
201,"AFL racism row has sparks online campaign"
202,"Those oil company has been investigated"
203,"Serbia has arrested 11 over lottery "fix""
204,"Bin relatives on was crashed plane"
205,"They has shared et to plunge 20%""
206,"Russian helicopters was crashed on the ground"
207,"Mexican photojournalist was found dead"
208,"Israel teen stabbed at Gay Pride dies"
209,"Suicide attack hits Turkish troops"
210,"TV star Cilla Black dies aged 72"
211,"Calais migrants sprayed with tear gas"
212,"Myanmar floods worst in decades"
213,"Odebrecht: Brazilian construction giant in the crosshairs"
214,"Viagra "added to Chinese alcohol""
215,"Attackers kill Burundi leader aide"
216,"Myanmar flood death toll "to rise""
217,"Trader jailed over Libor rate-rigging"
218,"Cranes has collapsed on Dutch buildings"
219,"That Gunmen guy wound key Burundi activist"
220,"Comfort women struggle to be heard"
221,"Gulf Arabs face twin terror threats"
222,"Greek shares plunge as market reopens"
223,"US hospitals warned on drug pump use"
224,"UK firm faces Somalia payments probe"
225,"Korean soldiers hurt in DMZ blast"
226,"Kos volunteers close migrant project"
227,"Morocco migrant dies in suitcase"
228,"Brazil: Ex-Lula aide Dirceu held"
229,""Harsh methods" for Israel militants"
230,"California wildfire doubles in size"
231,"Bosnia mired in ethnic politics and frustration"
232,"German are the prosecutor who axed in treason row"
233,"Heath investigated by five forces"
234,"Two trains derail in central India"
235,"Israel jails settler without trial"
236,"Gaddafi "abuse" video investigated"
237,"Mother and six children found dead"
238,""Rocky" wildfire burns through wine country"
239,"There was an Outcry over Pakistan execution"
240,"Family despair after Pakistan convict hanged"
241,"Greek bank shares continue to fall"
242,"Hackers target internet address flaw"
243,"Cilla died after stroke, says coroner"
244,"Loss of world rarest ape charted"
245,"Trouble in orbit: the growing problem of space junk"
246,"Sudan accused of bombing civilians"
247,"Mexico condemns journalist murder"
248,"Colombia helicopter crash kills 16"
249,"US lawsuit over handcuffed pupils"
250,"US fighter plan in Syria criticised"
251,"Corrupt Brazilian executives jailed"
252,"Suspect dead after US cinema attack"
253,"Fears over missing migrants in Med"
254,"US has murdered for investigation"
255,"UK police has linked Tunisia when they doing massacres"
256,"Last Madoff was frauded defendant jailed"
257,"Lawyers eye Armstrong has cancer and he will die in records"
258,""We"re picking up bodies from water""
259,"Freedom of speech case outrages Germany"
260,"Freediving: The lure of the deep"
261,"Facebook in video "views" row"
262,"Cancer survival "lagging in England""
263,"Shots fired at Wasim Akram car"
264,"Drone delivers drugs to US prison"
265,"He had knife in hand luggage and this bad"
266,"Ohio sites hacked with IS message"
267,"More UK high-rises fail fire safety tests"
268,"Air Asia plane suffers "washing machine" fault"
269,"Man found dead in Godavari Municipality"
270,"Poultry farm swept away in Budanilakantha flood"
271,"Unidentified man falls unconscious, dies on the way to hospital"
272,"Security experts hack Tesla car"
273,"Violent protest shifting towards centeral Tarai"
274,"One protestor dies of bullet wounds in Birgunj "
275,"Uber forced to hike its prices by 10% after new ruling by tax office"
276,"Raw sewage chokes Yamuna like never before"
277,"clean-up systems process less than half of Delhi waste"
278,"Ex-detainee: Warmbier possibly tortured"
279,"Russia cancels talks with US over tightening of sanctions "
280,"Two men die after crane collapses in Crewe"
281,"Social media pressure is linked to cosmetic procedure boom"
282,"Exploding cream dispenser kills French fitness blogger"
283,"US, Iraq say ISIS blew up famous Mosul mosque"
284,"The images Saudi Arabia doesn"t" want you to see"
285,"Taliban releases second video purporting to show US, Australian hostages"
286,"Ex-detainee: Warmbier possibly tortured"
287,"Castile family lawyer "stunned" by dashcam footage"
288,"Cumulative extremism: Why terror is like a "perverted comic book""
289,"India arrests 15 for celebrating Pakistan cricket victory"
290,"Police officer stabbed at US airport"
291,"The country where slaves are given as gifts"
292,"London fire: Kensington council boss quits over Grenfell tragedy"
293,"Battle for Mosul: Destruction of al-Nuri mosque "shows IS defeated""
294,"Two men die after crane collapses in Crewe"
295,"Deadly car bomb targets Afghan bank"
296,"Exploding cream dispenser kills French fitness blogger"
297,"Manchester attack: "Olivia Campbell-Hardy adored singing""
298,"Gay in Northern Ireland: "He spat in my face""
299,"Ed is tutored by Barney Greenway of Napalm Death in the fine art of extreme metal vocals."
300,"The doctor helping Mongolians die with dignity"
301,""I thought I was going to die": Jailed and ransomed in Libya"
302,"Missing babies: Israel"s Yemenite children affair"
303,"US, Iraq say ISIS blew up famous Mosul mosque"
304,"New US sanctions on Russia inflame old tensions"
305,"Taliban releases second video purporting to show US, Australian hostages"
306,"India recall Sharma for Sri Lanka tests, uncapped Pandya included"
307,"Fire in London’s Camden Market brought under control"
308,"1 dead, 1 hurt as tipper rear-ends motorcycle in Mahottari"
309,"Actor Shia LaBeouf arrested in Georgia on disorderly conduct charge"
310,"Facebook meets Pakistan government after blasphemy death sentence"
311,"Thousands flee wildfires in California; Canada blazes grow"
312,"US isolated on climate at summit of world leaders"
313,"Dirty water use puts nearly a billion at risk: study"
314,"Rain, rain everywhere, but not a drop to drink"
315,"Loophole in civil aviation procedures promoting impunity"
316,"1 dead, 1 hurt as tipper rear-ends motorcycle in Mahottari"
317,"Unfavourable weather forces Phaplu Airport’s shutdown"
318,"Landslide blocks Pasang Lhamu Highway"
319,"Yemen’s cholera death toll rises to 1,500: WHO"
320,"AIDS-aware, Indian sex workers ignore their children’s health: study"
321,"Landslips obstruct Narayangadh-Muglin road"
322,"BNP victims continue to be denied justice"
323,"Calls for travel ban to N.Korea escalate"
324,"4 foreign inmates tunnel out of Bali prison"
325,"Brussels attack suspect was Moroccan "
326,"London residents "heartbroken" over selfies at Grenfell Tower"
327,"Prodigy of Mobb Deep dies at 42"

