description,pubDate,title,url,image_url,article
"Fifty years ago, gay sex between men in private was decriminalised in England and Wales. Despite this, hate crimes against gay people have persisted, and the number of attacks recorded by police has been rising. There were 7,194 in England and Wales in the year to April 2016. Campaigners say this isn't the full picture, though, as many victims still don't report assaults.  Six people affected by hate crimes share their stories. ",1 August 2017,Beaten up for being gay,http://www.bbc.co.uk/news/magazine-40643461,https://ichef.bbci.co.uk/news/320/cpsprodpb/52CF/production/_96999112_9bb0de26-a57b-4d82-a7ff-f06fffea289e.jpg,"Fifty years ago, gay sex between men in private was decriminalised in England and Wales. Despite this, hate crimes against gay people have persisted, and the number of attacks recorded by police has been rising. There were 7,194 in England and Wales in the year to April 2016. Campaigners say this isn't the full picture, though, as many victims still don't report assaults.  Six people affected by hate crimes share their stories.  James and Dain were enjoying a night out together in Brighton in May 2016 when they were followed out of a nightclub and attacked on the seafront. The assault has left physical and emotional scars.  We were at the bar and we got this look from a couple of guys from across the dance floor. It takes a lot to make me feel uncomfortable but it was just such a weird look they gave us. Dain had his arm around me. I don't think they liked that. Then they started shouting at us. I told Dain we needed to get out of the club into a taxi the quickest way possible.   We left the bar. No-one was about. All of a sudden I heard running behind us. There was no way we were going to outrun them. They grabbed us from behind and chucked us to the floor. I was lying on the pavement and all I could see was James but the next thing I saw was a shoe coming towards my face. That knocked me completely unconscious.   One of the boys started kicking Dain's face really rapidly. There was a lot of aggression and shouting of ""gay boys"". Every time I tried to crawl closer to Dain, I was dragged along the pavement. At that point, a taxi drove past and called the police. I remember standing up for the first time and Dain looked at me and said, ""I can't see.""   My eye socket was completely shattered. I had haemorrhages in both my eyes and fractures on my cheeks. My tooth was chipped and my nose was broken as well. I remember being in hospital and kept asking, ""Am I going to be able to see again?"" They said, ""We can't tell you because everything is so swollen."" They couldn't even open my eyes.  James and I were very close anyway but spending that much time with each other really proved to me how strong our relationship is. I'm a very resilient person and I'm not going to live my life how someone else wants me to. I'm not going to let anyone change that. If anything, this has made me want to be who I am even more.   It's made him stronger and it's made him not care about what other people think and to go out there and be himself even more, whereas it's done the opposite to me. It's changed me. I've changed my thought process and mindset, how I think, how I look, how I speak, who I'm with, where we go and it's sad because I remember how we were before it happened and I look at us now and it's upsetting because it's them who made this happen. That's what's hard to accept.  It's a year since it happened and I thought things would probably get easier but they haven't. When we're out and about he wants us to look like we're together obviously but I'm scared of something similar happening again. It wasn't like that a year ago. We didn't go down the street holding hands but I wasn't fully aware of us making sure that we weren't seen as a couple.  I couldn't ever forgive the people who attacked us or forget what happened. It will stay with me and I'm sure it will stay with them for the rest of their lives.  I'm angry about everything that's happened - the fact that I had a black eye to explain to a six-year-old, why Mummy was hurt, why Becky had bruises. It's not something I want to explain to my child, that there's hatred in this world. It's odd that it still happens just because of who we choose to love. For once we had a babysitter and got out of the house and that happened. We haven't been out since.  The first thing he said was, ""I like lesbians"" and I thought ""Oh God, not one of these."" He had a South African accent, all seemed quite pleasant and he seemed quite tipsy but I'm never really rude to anyone. He asked our friends to kiss, to which they said ""No"" and I said, ""It's not for your pleasure.""  He said something like ""dyke"" which offended one of my mates. You don't say that. We went to the kebab shop to get a bit of food. I didn't think it was going to get violent.  Another guy that had begun joining in then started circling us as a group and focused his attention on me.   That's when he started getting touchy-feely, groping Alex's breasts and really hanging on her arm. He called us ""fat dykes"" and she pushed him away. The other guy saw her do it. He swung for her. James, Dain, Becky, Alex and Jenny tell their stories in the TV programme Is it safe to  be gay in the UK? Viewers in the UK can watch it at 21:00 on Tuesday 1 August on BBC One  .  The documentary is part of   - a season of programming across the BBC to mark the 50th anniversary of The Sexual Offences Act 1967, which partially decriminalised gay sex between men in England and Wales. I got groped, kicked and slammed into a street light. My wife got punched and our two friends got punched too. To hit a woman is wrong but do that just because we didn't want them is disgusting and vile. I am so angry I have been violated for loving my wife. The next day I had to wear glasses as I couldn't cover up the darkness around my eye. I feel guilty because I have chosen to love Becky which in turn has brought this crap into my son's life. Just me and him, we look completely normal. We wouldn't attract attention but being with Becky does because she is so obviously gay.  I'm disappointed, upset and angry with my attacker, at the court, the justice system. I just hope and pray it doesn't happen to someone else. Ian was the first born in the family and he was four years older than I was. He had this amazing smile, he just loved life really. When things were tough, he'd be there and he'd never judge you.  As we grew up, we went our separate ways. In our early 20s, I went to a gay party with a girl. It was packed. I looked across the room and I thought: ""That's Ian."" He spotted me. He came up to me, put his arm around me and he said, ""What are you doing here?"" and from that moment we realised we were both gay. That really forged this inseparable link. On the night he was attacked, he was walking down the street with his friend, Philip. He'd just had his first week at work so he was going out to have a drink.  Someone shouted, ""Faggots."" My brother turned round and said, ""I may be gay but…""  And then there was some kind of altercation. He was kicked in the groin and punched.   They were kicking him, stamping on him and shouting at him. It's shocking, absolutely shocking. I couldn't believe it. There was a crowd of people around him, which you can see on the CCTV footage. How could you leave somebody in that state? Why didn't they go back to him and check he was OK? Those questions still nag at the back of my mind. To walk away, how could you do that? Ian was in hospital for 18 days. When I got there he was unconscious with two big black eyes. His breathing was changing. My experience told me that this was the final breath. He struggled a bit and then he stopped breathing. And so he died. We were with him. It was very sad. Thousands of people with lights attended an extraordinary coming together of gay and straight people in Trafalgar Square because of what had happened. It was magic really and such a fitting event for Ian. Just across the road was where he was last conscious. I went there a couple of times to look. It really is significant. That tree, I know it very well. He's part of Trafalgar Square now. We always used to say, ""We can always live together when we get older and retire. We'll be like Darby and Joan and have a few tea parties."" We'd laugh about it. I probably miss him more and more as I get older.  You can't have hate and I think hate is a very divisive thing to hold on to. I'm starting the restorative justice programme and hoping that will give me some sense of closure and also that it will help the offenders. I'd like to meet them all. They're still alive and they have a life. I do care what happens to people and I know some people don't have the same advantages as others. I actually think he would support me doing this and this really will be a bit like a springboard in helping me move on. I'm hopeful. It started in Manchester in 2005 when I experienced three separate instances of homophobia in one day.  People were really shocked that I had these experiences all the time and I thought, ""I have to do something about this.""   I began to plant pansies wherever I'd experienced abuse. I wanted to do something that changed the location. I never wanted there to be any signage, it had to be something that was subtle but noticeable, in the way that I am in the street. A pansy is a pansy, you kind of understand and read what it's about just by knowing it's there. Quite quickly, people started telling me where they had experienced abuse and I started planting for them too. If I plant a flower for someone who's been murdered I usually dedicate it to them. I take photographs and add them to  .   I often name the pansy after the abuse that has happened. The first one I planted was called: ""I think it's about time we went gay bashing again."" Two builders sitting on a wall said that directly to my face and I was so shocked I really didn't know what to do. When you have that experience you're forced to think about what it is you can do. Do you react, do you close up?  The ritual of digging into the ground, kneeling on the ground, feels solemn and slightly healing. I'm subverting this terrible thing that's happened and turning it into something more positive. It also raises awareness. When someone's been violently attacked, the location is so loaded that they can't stop thinking about it when they go past. What I witness when I go back with them is their experience and healing of that location. They can then think: ""This isn't only the place where I was beaten up but also somewhere a pansy was planted."" It's almost like sticking a plaster over the violence. I plant pansies wherever I am. Unfortunately everywhere I go there's usually a place where someone has experienced homophobia. If I mark a location for someone I don't know, I'll contact them using social media saying, ""I've done this for you."" Every single pansy marks a story of someone who has experienced homophobia on the streets. I don't think it will end. I will always plant them."
"According to the regulator, Ofgem, it is possible to save about £300 a year if you switch your gas and electricity provider.",1 August 2017,How to switch energy supplier,http://www.bbc.co.uk/news/business-40791217,https://ichef.bbci.co.uk/news/320/cpsprodpb/6243/production/_97155152_gettyimages-469214836.jpg,"According to the regulator, Ofgem, it is possible to save about £300 a year if you switch your gas and electricity provider. The best savings involve taking out a ""dual fuel"" deal, where one provider supplies both forms of energy. Many people have been put off switching, but Ofgem maintains the process is very simple. Not everybody is able to switch their supplier. If you are in debt to a supplier, you might not be able to.  If you have a pre-payment meter and you owe more than £500 for gas or electricity, you might not be able to switch. There are two main types of energy deal, a fixed-term contract, typically lasting a year or 18 months, and a standard variable tariff. If you are one of the two-thirds of householders on a standard variable tariff, the potential for savings is larger. However, over the past few years the gap between standard variable tariffs and fixed rates has narrowed, as can be seen from the graph below. You will need: The change should take no longer than 17 days. That includes a 14 day cooling-off period. Your supply will not be interrupted during that time.  If you are on a fixed-rate deal and decide to switch before it ends, you may be charged an exit fee. But if you are within 49 days of the end of the deal, you should not be charged. You can contact your supplier directly, and ask if they can give you a better deal. But there will be a wider choice of deals through price comparison websites. Ofgem provides this list of approved sites: Quotezone, The Energy Shop, Runpath, Simply Switch, My Utility Genius, Switch Gas and Electric, Energylinx, Unravel It, Money Supermarket, Energy Helpline and Uswitch. These sites do not have to advertise the cheapest deals. They advertise those that you can switch to straight away, and with whom the websites have made an agreement. Better deals may be available if you are prepared to wait. However, the regulator Ofgem, is considering forcing such websites to include a clickable option to see all tariffs available, not just preferred suppliers. Citizens Advice:  Ofgem:  Which?"
Friends fans rejoiced last week when it was announced that Jennifer Aniston is returning to TV screens.,2 August 2017,Why are there so many TV shows about TV shows?,http://www.bbc.co.uk/news/entertainment-arts-40791407,https://ichef-1.bbci.co.uk/news/320/cpsprodpb/1D46/production/_97149470_tv-comp-new-reuters-getty.jpg,"Friends fans rejoiced last week when it was announced that Jennifer Aniston is returning to TV screens. She and Reese Witherspoon are   in a new HBO series set behind the scenes of a breakfast news show. The currently-untitled project is the latest in a whole host of films and TV series to take an audience behind the camera - which raises the question of why viewers find them so fascinating. ""We all consume TV news, but it's quite hard to actually see behind it because it has to look so professional,"" says BBC Breakfast's Naga Munchetty. ""But the characters you find behind the scenes are so interesting.""  One criticism that has been levelled at dramas and sitcoms set behind the camera is that they are just navel-gazing - the media obsessed with itself yet again. ""There's always that risk,"" Naga says, ""But I think if you're really into politics you'll watch The Thick of It and The West Wing, and similarly if you love TV or news, you'd enjoy something like this as well.  ""Look how many medical programmes there are, or shows about lawyers or the police - we're fascinated by certain industries whether we work in them or not.""  Looking ahead to Aniston's new HBO show, Naga is confident the writers won't be short of material. ""Lots of stuff happens behind the scenes that is amusing,"" she says. ""Guests and presenters sneaking in, slurps of tea being hurriedly swallowed when it's supposed to be be our turn to talk. ""Correspondents trying to tell the story when members of the public are interfering with their job - making noise, pulling funny faces and so on."" The BBC Breakfast presenters themselves even have a tough time holding things together - regularly falling into  . ""Sometimes the audience catches our slip-ups and likes to get a bit of insight - the ability to roll with the mistakes makes the job easier,"" Naga says. ""In fact, one of the things I learned was if you make a mistake, you laugh it off, because we're all human, and it can often seem like people reading the news are one step removed from everyone else."" The questions presenters gets asked every day by members of the public is perhaps proof of how interested viewers are in the process of putting TV shows together. ""'What time do you wake up? Who's your favourite person to work with? What time do you go to bed?'. People love to know the most difficult guests and things like that,"" Naga laughs. But presenting a TV news programme is a lot harder than it looks, she adds. ""This new HBO series would need to show that it understands how much work is needed to be able to appear breezy and relaxed first thing in the morning,"" says Naga.  ""If you know your stuff you can be very relaxed. You're never allowed to moan about being tired - everyone there is so there's no point talking about it."" Naga jokes there would be a fair few storylines to be written about ""guests who turn it on for the camera but off camera are as cold as ice"". One trap that shows based in newsrooms can easily fall into is presenting a sanitised version of a job that isn't as glamorous as it looks. The Newsroom received some criticism for presenting a media workplace which ""could never exist in the real world"", as   put it. Naga herself points out that one of the many pitfalls a show like this could fall into would be for it to ""become farcical"".  ""Don't forget we are journalists and have to cover serious stories every day,"" she says. ""We are one of the first sources of news for families and must make sure we are accurate, accessible and timely. ""We have to finely balance the need to be serious and fun - not always easy as we are led by the news of the day. ""As breakfast presenters, we're part of people's lives. We are there while the audience is getting on with their day, while they have their routine, and so you have to be really aware that people feel they know you."" Asked whether she might watch Aniston's new show, she jokes: ""Yes - as long as is not on too late in the evening!"""
"We all love Thai curries, Japanese noodles and Indian snacks, so why not Asian-inspired desserts? With the amount of ice cream sold dropping globally, manufacturers are starting to experiment with exotic flavours to whet flagging appetites.",2 August 2017,Are the days of the 99 ice cream cone numbered?,http://www.bbc.co.uk/news/business-40610570,https://ichef.bbci.co.uk/news/320/cpsprodpb/4533/production/_97151771_icecream3.jpg,"We all love Thai curries, Japanese noodles and Indian snacks, so why not Asian-inspired desserts? With the amount of ice cream sold dropping globally, manufacturers are starting to experiment with exotic flavours to whet flagging appetites. In late 1944, Major Hunter Reinburg, commanding officer of 122 Squadron of the American Marine Corps, had a hankering for ice cream.  Not surprising perhaps, since he was posted to the sweltering, jungle-covered South Pacific island of Peleliu.  So Hunter set his resourceful team of aircraft engineers to work on Operation Freeze. After some trial and error, they found that by mounting a large can filled with milk onto the underside of each wing tip of their fighter planes, attaching a stirring shaft to a wind-driven propeller, and then undertaking a training sortie at 30,000 feet, they could supply 100 servicemen with a helping of ice cream every day, whilst simultaneously provoking the Japanese to waste a few shells trying to bring them down.  Hunter was, however, missing a trick.  If, instead of flavouring his favourite treat with army-issue cocoa powder, he'd cast his eye around him to see what fruits and spices the South Pacific had to offer, then he really would have been ahead of his time. He could have tried lychee, coconut, cardamom, nutmeg or ginger - flavours that ice cream makers are now starting to experiment with. In the 70 years since Hunter went to such lengths to satisfy his passion for frozen dairy desserts, global ice cream brands have spread their reach to almost every corner of the planet. Even in Peleliu he could now probably pick up a Cornetto from his corner store. But for many years, flavours from the big international brands remained stubbornly conservative,  dominated by chocolate, strawberry and vanilla. Now though, thanks to migration, long-haul travel, and the internet, consumers are becoming more adventurous and manufacturers are taking note. Parlours have sprung up across the US offering Persian-style saffron, orange blossom, and rosewater ice cream, sprinkled with nuts and drizzled with honey; and Indian-inspired flavours such as masala chai, pineapple, and kulfi.  At Chinatown Ice Cream Factory in New York, where they've been offering exotic ice creams for 40 years, they've noticed an uptick in interest from customers. Owner Christina Seid says there's often a queue of 20 customers waiting to try her Chinese-inspired range, which includes red bean, toasted sesame, and taro (a kind of sweet potato) ice cream. She thinks Americans are ready to embrace these flavours in a way they perhaps weren't when her parents, Chinese immigrants, first set up the shop. ""My father was the pioneer of a lot of these flavours. Back then people didn't even know what a mango or green tea was. ""Now, nothing is really weird."" She thinks red bean flavour, common in China, will eventually become mainstream in the US. In many of the world's biggest ice cream markets appetites have been flagging for traditional take-home tubs. Consumers are worrying about the sugar content and there's a lot of competition.  According to  , global ice-cream sales fell from 15.6bn litres in 2015 to 13bn last year. As a result, firms are watching what happens in places like The Chinatown Ice Cream Factory carefully.  ""Trends are born in the parlours where they can afford to take a gamble,"" says Alex Beckett, global food and drink analyst at Mintel. ""They become fashionable. Then they travel from Brooklyn to LA and Chicago, then to Sydney, London, Berlin, and eventually they will be picked up by manufacturers who will start to set the market for these more ethnic styles""  Yee Kwan Chan, who is based in the UK city of Sheffield and whose family is also Chinese, travels to far flung parts of the world in search of inspiration for her Yee Kwan line of desserts. ""I just want to create authentic flavours you'd find in Asia,"" she says.  Her concoctions include chocolate miso, black sesame seed, and durian - the fruit with the pungent odour often likened to sewage or something rotting - which is surprisingly popular in Asia. At Christmas she travelled to Hong Kong and is now producing egg custard tart ice cream, evoking the afternoon tea treat popular there. ""With the East Asian palate we've got sweet and we've got sour and then we have bitter: we use all our senses,"" says Ms Chan.  With foreign travel and Asian food so popular, she's convinced that Asian-inspired flavours will be on the shop shelves in the US and Europe as a matter of course in a few years' time.  But for that to happen at any scale, larger manufacturers will also need to get on board. Unilever, the world's largest producer, is open to the idea.  They already make a myriad of flavours to suit local palates, including red bean Cornettos in China, a liquorice recipe for Scandinavia, and they've just launched a ""dung dung"" ice cream - based on an ""earthy"" tasting fruit - in Indonesia.  Matt Close, Unilever's executive vice president of global ice cream, says they've always got an eye out for new flavours that might ""travel"". More from the BBC's series taking an international perspective on trade: This year in India, the world's fastest growing ice cream market, they launched a kulfi ice cream, made with condensed milk and flavoured with rose water so it tastes a little like Turkish Delight. ""I'm absolutely convinced kulfi would work in the UK,"" says Mr Close. ""You'd start where there are big Indian communities, but there is no reason that wouldn't stretch.""  While taro and red bean recipes might be harder to export, matcha (green tea) flavours seem likely to be at the forefront of any Asian invasion, he thinks. ""We've just launched a matcha ice cream in the Philippines. We'll take it to other markets.  ""I'd put money on the idea that there'd be green tea ice cream or green tea ice lollies in most markets in the not too distant future."" Booza - also known as Dondurma (in Turkey), this is made with ground powdered orchid root and mastic gum. These ice creams melt more slowly and have a thicker, chewier texture. Thai rolled ice cream - the latest Asian ice cream trend involves pouring mixture onto a freezing slab of metal then rolling it up like a piece of paper Durian ice cream - only the very adventurous are usually attracted by the the prickly Asian fruit that smells so bad it's illegal to carry it on the subway in Singapore. An acquired taste."
