description,pubDate,title,url,image_url,article
"It's 26 years since Yugoslavia broke into pieces and the republic of Macedonia came into being. In all that time, the new country has lacked an official, internationally agreed name, because of Greece's objections to the name ""Macedonia"". And for nearly all of that time, explains Alex Marshall, one man has been working to solve the problem.",2 August 2017,The man who has focused on one word for 23 years,http://www.bbc.co.uk/news/magazine-40781213,https://ichef.bbci.co.uk/news/320/cpsprodpb/5F04/production/_97142342_nimetz_getty976.jpg,"It's 26 years since Yugoslavia broke into pieces and the republic of Macedonia came into being. In all that time, the new country has lacked an official, internationally agreed name, because of Greece's objections to the name ""Macedonia"". And for nearly all of that time, explains Alex Marshall, one man has been working to solve the problem. Matthew Nimetz wants to make something clear - he has not spent every waking moment of the past 23 years thinking about one word: ""Macedonia"". ""I have probably thought about it more than anyone else - including in the country,"" says the 78-year-old US diplomat. ""But I have to disappoint anyone that thinks it's my full-time job."" Since 1994, Nimetz has been trying to negotiate an end to arguably the world's strangest international dispute, in which Greece is objecting to Macedonia's name and refusing to let it join either Nato or the EU until it's changed. Greece says the name ""Macedonia"" suggests that the country has territorial ambitions over Greece's own Macedonia - a province in the north of the country - and is a blatant attempt to lay claim to Greece's national heritage. It should be called something like ""Skopje"" instead, Greece argues - Skopje being Macedonia's capital city. Macedonia, by contrast, argues that you can trace its people back to the ancient kingdom of Macedon, once ruled by Alexander the Great - and that the name ""Macedonia"" is therefore the obvious choice. One upshot is that travellers entering northern Greece from the Republic of Macedonia, and those crossing the border in the opposite direction, are both greeted by roadside signs welcoming them to Macedonia. When Nimetz began his work on the dispute he was serving as US President Bill Clinton's special envoy, but since the end of 1999 he's been the personal envoy of the UN secretary-general - his task to nudge the two sides slowly towards a resolution, for a token salary of $1 per year. Macedonia got into the UN by agreeing to be called The Former Yugoslav Republic of Macedonia (FYROM) for all official purposes, but this was not intended to be a permanent solution to the problem, and created a new set of difficulties. ""It makes for very awkward sentence construction,"" Nimetz says, with some understatement.  Ban Ki-moon, the former UN secretary-general, once got muddled and called the country the ""Former Yugoslav Republic of Yugoslavia"" by accident. ""He said to me, 'You've got to solve this problem. It's driving me crazy,'"" Nimetz says. Despite the glacial pace of negotiations, he has never seriously thought of quitting. ""Some people think it's me just sitting there thinking of adjectives to put in front of the name Macedonia - like New Macedonia, Upper Macedonia - but this issue has historical importance… importance in terms of nation-building,"" he says.  ""And it is never boring, the cast of characters dealing with it changes all the time. Think of a theatre director who does King Lear or Hamlet, but with different staging and actors. Do they get bored?"" When Nimetz first became Clinton's envoy, back in the 1990s, it looked as though the dispute could spiral out of control.  Greece had been objecting to Macedonia's name since 1991, when Macedonia declared independence from Yugoslavia. The following year, a million Greeks - a 10th of the population - took to the streets of Thessaloniki to protest.  Those protests helped bring down the country's prime minister, and his replacement, Andreas Papandreou, barred Macedonia's access to Greek ports. Macedonia was a "" "", he claimed. Nimetz has a surprising amount of understanding for the Greek fear that Macedonians could one day lay claim to Greek territory. ""I have to explain to people this Greek concern about irredentism is not just created out of thin air,"" he says. ""Within the last three generations, these sorts of threats were real to the country. This feeling that 'We're always being encircled.' In the Balkans, each country has a history of being dismembered, or having fought off their neighbours at some point."" He once explained the dispute to US senators by asking how they would feel if Mexico changed its name to The Republic of Mexico and Texas, then started publishing historic maps implying ownership of the whole south-west US.  However, he has equal understanding for the Macedonians. ""When the Greeks say to them, 'Oh, you only came here in the 9th, 10th Century - you're not really from this region. You should call yourselves, at the most, New Macedonia,' well, to the people of The Former Yugoslav Republic of Macedonia, that's a problem. They don't consider themselves 'new'. They consider themselves indigenous as anyone."" Despite this, Nimetz did at first think there would be a quick end to the dispute. So did leading Macedonian politicians. ""I talked about it with them and they said, 'Time is in our favour. Let's just talk a few years, let things calm down, change some people in government.' But it didn't quite work that way,"" he says. A long list of names has been suggested: everything from New Macedonia and Nova Makedonija, to Slavo-Macedonia and the Republic of Skopje. At one point, both the Upper Republic of Macedonia and the Republic of Upper Macedonia were on the table.  But none has yet been accepted.  It may seem as though there are no more adjectives left to try - or any point trying them - but Nimetz insists disputes get solved when the timing is right.  Just look at Northern Ireland or the reunification of Germany, he says. Change may occur because events make people look at an issue in a new light, or new leaders may come in with the political authority take tough decisions. Or people may just get exhausted by never-ending debate. He is optimistic that the timing may be right for this dispute soon. This is partly due to new leadership in Macedonia - the Social Democrat Zoran Zaev became prime minister this year, breaking a long political deadlock in the country. But also because Macedonia needs to find a solution so it can get closer to its goals of joining Nato and the EU. ""Doing that would give them reassurance, legitimacy, economic opportunities… and a sense of permanence,"" Nimetz says. It also might ease tensions in the country between ethnic Macedonians and Albanians, who make up a quarter of the population. In 2001, such tensions brought the country to the brink of civil war. But Nimetz admits convincing voters in both countries will be difficult. Macedonian leaders have promised any agreement will go to a referendum. He thinks part of the way out is to encourage people not to see this as a question of national identity. ""One ordinary citizen in Skopje once said to me: 'When I get up in the morning and I'm shaving, I look in the mirror and say,  . Well, tomorrow, when I'm shaving, do you expect me to say,   or  ?'  ""I told him his concern is understandable, but it's the wrong way to look at this. We are only talking about the formulation of the name of this state for diplomatic purposes. It won't impact the average person. ""We're not negotiating identity. If we were, I'd be out of here."" He does recognise that identity is important, though - despite being ""a great believer in globalism"". ""I believe there's a tribal aspect to us as a species,"" he says, ""and it's very hard to feel comfortable in a global world, even for people like me."" In all his time working on the dispute, there has been only one moment when Nimetz united both sides. It was at an unlikely time too, when Macedonia was putting up numerous statues of Alexander the Great in its cities, and had named its main airport after him, causing outrage in Greece. ""When that was happening, I said to a reporter from Skopje, 'I can't understand all this, because Alexander the Great was a great military leader, but he destroyed so much and killed so many people.' Well, I got hell for that - from all sides. I almost resigned.""  Nimetz has just finished his latest round of meetings on the issue, meeting politicians in Skopje, and Greece's foreign minister. A solution can be achieved, he insists, but for the immediate future he is busy simply planning a holiday ""up above the Arctic Circle to a lodge where the caribou migrate"". A good chance to get away from questions about national identity and self-determination, surely? ""Well, actually,"" he says, ""Maybe not, when you think about the First Nations of Canada…""  He then starts enthusiastically explaining Canada's debate about indigenous self-government, and it quickly becomes clear that his love of such questions is the real reason he has been able to work on a dispute about just one word for the past 23 years."
"When there are debates about the world's top performing education systems, the names that usually get mentioned are the Asian powerhouses such as Singapore and South Korea or the Nordic know-alls, such as Finland or Norway.",2 August 2017,How Canada became an education superpower,http://www.bbc.co.uk/news/business-40708421,https://ichef-1.bbci.co.uk/news/320/cpsprodpb/3667/production/_97072931_canada150.jpg,"When there are debates about the world's top performing education systems, the names that usually get mentioned are the Asian powerhouses such as Singapore and South Korea or the Nordic know-alls, such as Finland or Norway. But with much less recognition, Canada has climbed into the top tier of international rankings. In the most recent round of international Pisa tests, Canada was one of a handful of countries to appear in the top 10 for maths, science and reading. The tests, run by the Organisation for Economic Co-operation and Development (OECD), are a major study of educational performance and show Canada's teenagers as among the best educated in the world. They are far ahead of geographical neighbours such as the US and European countries with strong cultural ties like the UK and France. At university level, Canada has the world's highest proportion of working-age adults who have been through higher education - 55% compared with an average in OECD countries of 35%. Canada's success in school tests is also very unusual compared with other international trends. The top performers are often cohesive, compact societies and the current highest achiever, Singapore, has been seen as a model of systematic progress, with each part of the education system integrated into an overarching national strategy. Canada does not even really have a national education system, it is based on autonomous provinces and it is hard to think of a bigger contrast between a city state such as Singapore and a sprawling land mass such as Canada. The OECD, trying to understand Canada's success in education, described the role of the federal government as ""limited and sometimes non-existent"". Also not widely recognised is that Canada has a high level of migrants in its school population. More than a third of young adults in Canada are from families where both parents are from another country. But the children of newly-arrived, migrant families seem to integrate rapidly enough to perform at the same high level as their classmates. When the most recent Pisa rankings are looked at more closely, at regional rather than national level, the results for Canada are even more remarkable. If Canadian provinces entered Pisa tests as separate countries, three of them, Alberta, British Columbia and Quebec, would be in the top five places for science in the world, alongside Singapore and Japan and above the likes of Finland and Hong Kong. So how has Canada overtaken so many other countries in education? Andreas Schleicher, the OECD's education director, says Canada's ""big uniting theme is equity"". Despite the different policies in individual provinces, there is a common commitment to an equal chance in school. He says there is a strong sense of fairness and equal access - and this is seen in the high academic performance of migrant children. Ideas for the  ? Get in touch. Within three years of arriving, the Pisa tests show the children of new migrants have scores as high as the rest of their schoolmates. It makes Canada one of the few countries where migrant children achieve at a level similar to their non-migrant counterparts. Another distinguishing feature is that Canada's teachers are well paid by international standards - and entry into teaching is highly selective. Prof John Jerrim, of the UCL Institute of Education in London, says that Canada's high league table ranking reflects the narrow socio-economic gap in school results. Rather than a country of extremes, Canada's results show a very high average, with relatively little difference between advantaged and disadvantaged students. In the most recent Pisa results for science, the variation in scores in Canada caused by socio-economic differences was 9%, compared with 20% in France and 17% in Singapore. The equitable outcome goes a long way to explaining why Canada is doing so well in international tests. It does not have a tail of underachievement, often related to poverty. It is a remarkably consistent system. As well as little variation between rich and poor students, there is very little variation in results between schools, compared with the average for developed countries. Rather than high levels of immigration being seen as a potential drag on results, Prof Jerrim says in Canada's case, this is likely to be part of its success story. Migrants coming to Canada, many from countries such as China, India and Pakistan, are often relatively well-educated and ambitious to see their children get into professional careers. Prof Jerrim says these families have an immigrant ""hunger"" to succeed, and their high expectations are likely to boost school results for their children. This has been a bumper year for education in Canada. The universities are reaping the benefits of the Trump effect, with record levels of applications from overseas students seeing  . There has also been a Canadian winner of the Global Teacher Prize, with  . As Canada marks its 150th anniversary, it can claim the status of an education superpower."
"From the northern lights to noctilucent clouds, the range of subjects in this year's competition covers all things astronomical. Here is a selection of the shortlisted images.",2 August 2017,In pictures: Astronomy Photographer of the Year 2017,http://www.bbc.co.uk/news/in-pictures-40789348,https://ichef.bbci.co.uk/news/320/cpsprodpb/714D/production/_97150092_abattlewearelosinghaitongyu.jpg,"From the northern lights to noctilucent clouds, the range of subjects in this year's competition covers all things astronomical. Here is a selection of the shortlisted images. The Milky Way rises above a small radio telescope at Miyun Station, National Astronomical Observatory of China, Beijing, in Haitong Yu's photograph. The image depicts light pollution, which together with electromagnetic noise, has turned many optical and radio observatories near cities both blind and deaf.  To make this image, Haitong Yu used a light-pollution filter and stacked multiple frames to show the Milky Way above the city light.  This picture of the aurora borealis swirling above snow covered trees in Murmansk, Russia, was made by Yulia Zhulikova. The trees glow a vivid pink, highlighted by street lamps. Ainsley Bennett captures the waxing crescent Moon setting in the evening sky over the Needles Lighthouse on the western tip of the Isle of Wight.  Despite the Moon being a thin crescent, the rest of its shape is defined by sunlight reflecting back from the Earth's surface. A large, searing hedgerow prominence extends from the surface of the Sun in Paul Andrew's picture. A number of different prominence types have been observed emanating from the Sun, and the hedgerow prominence is so called because of the grouping of small prominences resembling rough and wild shrubbery.   A snow-clad mountain in the Eastern Sierras, California, towers over an aspen grove in Brandon Yoshizawa's image. Above this autumn scene, the Milky Way shines. Taken from Victoria Peak, the highest mountain on Hong Kong Island,  Prisca Law's image shows a busy city in contrast to the peaceful starry sky.  The yellow haze above the landscape is light pollution. Along the coastline roads, the pattern of light signifies the fast-paced life of cities. After a long hike from his small cabin to Kvalvika, Lofoten Islands, in Norway, Nicolas Alexander Otto arrived at the slopes above the beach at about midnight.  During the hike, the aurora borealis display was relatively weak. But when he made it to the beach, the sky ignited in a colourful show of greens and purples framed by the mossy landscape.  The image was composed from six different exposures due to the high ISO camera setting and thermal noise in the foreground. The sky was added from one of these exposures.  A shooting star flashes across the sky over the craggy landscape of Portland, Dorset, as the planet Jupiter glows in Rob Bowes's photograph.  The image was made from two exposures: one for the sky and one for the rocks.  The International Space Station moves across the face of the Earth's natural satellite, the Moon, photographed in broad daylight by Dani Caxete. The ISS was illuminated by the Sun at a height of nine degrees on the horizon.  Like the Moon, the ISS receives solar rays during its several orbits of the Earth a day, making it possible to see it when the Sun is still up.  This image was made with a single shot, with no composite or clipping in the process. Noctilucent clouds stretch across the Swedish sky, illuminating Ruslan Merzlyakov's ride home in this dramatic display.  Noctilucent clouds are the highest clouds in the Earth's atmosphere and form above 61km (200,000ft).  Thought to be formed of ice crystals, the clouds occasionally become visible at twilight when the Sun is below the horizon and illuminates them. On 31 October 2016, Near Earth Asteroid 164121 (2003 YT1) made a close encounter with Earth at three million miles.  This Apollo asteroid with an orbital period of 427 days was discovered by the Catalina Sky Survey on 18 December 2003.  Derek Robson's attempt at imaging the asteroid was done with a camera on a fixed tripod, controlled by Astrophotography Tool software.  Lying in the constellation of Gemini, IC443 is a galactic supernova remnant, a star that could have exploded as many as 30,000 years ago, Its globular appearance has earned the celestial structure the moniker of the Jellyfish Nebula.  In this picture made by Chris Heapy, at the upper left of the Jellyfish Nebula there is a much fainter background area of nebulosity, which is a large cloud of mostly molecular hydrogen gas and dust. Professional observatory data shows that what we are actually seeing are two lobes superimposed on each other, but from this angle one appears as the head of the jellyfish (to the left) and the other lobe (to the right) as the dangling tentacles.  All photographs courtesy of  ."
"An actress whose 32-year-old husband has died from a brain tumour has paid tribute to her ""incredible husband"". ",2 August 2017,Actress Holly Matthews' tribute to husband Ross Blair,http://www.bbc.co.uk/news/uk-england-40796144,https://ichef.bbci.co.uk/news/320/cpsprodpb/991B/production/_97159193_10914966_10153021062294061_4832653856667078727_o.jpg,"An actress whose 32-year-old husband has died from a brain tumour has paid tribute to her ""incredible husband"".  Waterloo Road and Byker Grove star Holly Matthews has  coping with husband Ross Blair's illness since his diagnosis in 2014.  The Coventry mum of two girls told the Coventry Telegraph they were dealing with  . Mr Blair, the son of ex-Aston Villa and Coventry City player Andy Blair, died on Saturday. He died at Myton Hospice and Ms Matthews has so far raised more than £9,000 for the charity.  She thanked the hospice for the ""dignity and love"" given to her husband and said the support for her family, including her daughters had been ""incredible"".  Ms Matthews said: ""On Saturday July 29, just as the final whistle was blowing for the end of Saturday football, my incredible husband took his last breath. ""He was surrounded by me, his mum (Dionne Blair), dad (Andy Blair) and sister (Ashley Blair), peacefully and with the support of the incredible Myton Hospice staff. ""The loss we are feeling is unfathomable right now and breaking the news to my daughters was extremely tough, but we are supporting each other and taking it one step at a time."""
A primary school teacher who watched a live stream of a six-year-old boy being raped has been jailed.,1 August 2017,Teacher jailed for watching live stream of child rape,http://www.bbc.co.uk/news/uk-england-somerset-40796362,https://ichef.bbci.co.uk/news/320/cpsprodpb/A7CB/production/_97155924_teacher.jpg,"A primary school teacher who watched a live stream of a six-year-old boy being raped has been jailed. Wayne Brookes joined 45 other paedophiles online to watch the abuse being streamed live from America. Bristol Crown Court heard he also used the site to watch a recording of a six-month-old baby being abused. Brookes, 43, from Weston-super-Mare, Somerset, admitted four charges of making indecent images of children and was jailed for 20 months. The court heard the former teacher accessed the online chat room after being given a 10-digit code by another paedophile. The rapist who broadcast the attack was arrested in the US in February and jailed for up to 30 years. Brookes, who had worked as a teacher for 10 years, was identified by officers after using a profile named Bear to access the chat room. He was found to have downloaded more than 200 indecent images of children, including dozens in the highest category. Judge Martin Picton said he had kept his interest in young children a secret from his partner, viewing the indecent material ""late at night"". ""One of the pieces of footage depicted the live streaming of a rape of a little boy,"" he added. ""I do give you the benefit of doubt with the issue of whether you understood that you were watching a live event."" The judge said although there was ""no suggestion"" that Brookes accessed indecent images at work or ""offended against any of the children"" in his care, his offences would have caused ""alarm and distress"" at the school where he worked. Defence barrister Virginia Cornwall said Brookes had ""demonstrated remorse and understanding for his criminality"" and was ""a broken man"". Brookes is the second of four men to be sentenced following an investigation into the chat room by the National Crime Agency. Last month, youth worker   for his part in the live stream of the rape. Philip Crabtree, 35, of Newcastle-Under-Lyme, and Christian Johnson Lueking, 36, of Raynes Park, London, are currently awaiting sentencing."
A man has died after falling more than 70m on Snowdon.,1 August 2017,Man dies in 70m Snowdon mountain Pyg track fall,http://www.bbc.co.uk/news/uk-wales-north-west-wales-40796503,https://ichef-1.bbci.co.uk/news/320/cpsprodpb/997F/production/_97159293_snowdonfall1.jpg,A man has died after falling more than 70m on Snowdon. His body was recovered by Llanberis Mountain Rescue Team volunteers after the incident on the Pyg track at about 18:30 BST on Monday. He was taken from the cliff on a stretcher to Llyn Glaslyn lake before being carried off the mountain. The man is the second person in three days to have died on the Snowdonia mountain range in Gwynedd after a man  .
