description,pubDate,title,url,image_url,article
Plans to rip up road humps to combat air pollution have been ridiculed by safety campaigners.,2 August 2017,Axing speed bumps to cut pollution 'is daft',http://www.bbc.co.uk/news/uk-politics-40788674,https://ichef.bbci.co.uk/news/320/cpsprodpb/15EA5/production/_97156798_mediaitem97156797.jpg,"Plans to rip up road humps to combat air pollution have been ridiculed by safety campaigners. They are writing to ministers to warn that removing speed bumps will actually increase danger to children. The government said it would fund councils in England to tear out humps because they elevated pollution as drivers surged between them. Campaigners say the risk of accidents from speeding drivers almost certainly outweighs the long-term pollution risk. A government spokeswoman promised that road safety wouldn't be compromised by any changes. Safety organisations think the government's policy is motivated by the desire to appear pro-motorist at a time when drivers are aggrieved by possible restrictions on diesel cars. Living Streets, which campaigns for children to walk safely to school, says if councils remove road humps without installing other measures such as chicanes or speed cameras, it will deter children from walking and cycling. Instead, the group say, they will be taken to school in cars, which in turn will increase pollution while reducing exercise for children. Its spokeswoman Rachel Maycock, who has a three-year-old daughter, told BBC News: ""This idea is completely daft and irresponsible.  ""Of course we all worry about the air our children breathe - but we also worry about reckless drivers going far too fast."" The group has written to protest to Environment Secretary Michael Gove, along with the Campaign for Better Transport and the cycle organisation CTC. The campaigners say the government has misinterpreted guidance from the National Institute for Clinical Excellence. The guidance says that ""where physical speed reduction measures are used to reduce road danger and injuries, consider using them to encourage drivers to maintain a reduced, steady pace along the whole stretch of road, rather than road humps that may increase acceleration and braking-related emissions"".  A spokeswoman for NICE told BBC News: ""We don't say anything about ripping up road humps and getting rid of them - we just want to promote smoother driving.  ""Whenever we make a recommendation about considering any measures other than speed humps, the media reports it as us recommending getting rid of speed humps - which we are not.""  She said if councils were considering measures to slow traffic, average speed cameras might be more effective in some cases than humps.  Seven safety groups contacted by BBC News all said the humps policy was a distraction from the real issue in the environment department's nitrogen dioxide (NO2) reduction strategy. They complained that the government had ignored advice from its own technical experts that the fastest way to lower pollution was by charging drivers of dirty vehicles to enter cities. Roger Geffen, from CTC, said: ""While drawing up plans to tackle lethal air pollution, ministers received evidence that road user charging would be the most effective way.  ""However, they said they'd rather councils removed speed humps instead.  ""Far from reducing the annual death toll due to pollution, that would merely increase the numbers of people killed by speeding instead.  ""Do we really need yet another court case before ministers heed the advice of their experts?"" Dr Adrian Davis, visiting professor of health and transport at the University of the West of England, told BBC News: ""The fact is, numerous studies had shown that unless drivers are forced to slow down by physical obstacles like road humps they will continue to drive too fast in residential areas. ""Scrapping humps without replacing them with some other form of physical measures would be both ridiculous and dangerous."" But Hugh Bladon, from the Alliance of British Drivers, welcomed the decision to fund the removal of humps, saying that they would inevitably increase pollution and reduce fuel efficiency because many drivers would accelerate away from them. ""It needs better education for drivers to drive smoothly and safely, rather than road humps,"" he told BBC News. ""I admit I don't know how you would achieve that."" A government spokeswoman promised that road safety wouldn't be compromised by any changes.  She said: ""Reducing roadside pollution is a priority for this government - which is why we have committed £3bn to help towns and cities take action against harmful emissions caused by dirty diesels."""
The Duke of Edinburgh will meet Royal Marines in his final public engagement before he retires from royal duties.,2 August 2017,Prince Philip to carry out final official engagement,http://www.bbc.co.uk/news/uk-40798469,https://ichef.bbci.co.uk/news/320/cpsprodpb/92DB/production/_97159573_774d876c-be45-4699-aace-4bc462221828.jpg,"The Duke of Edinburgh will meet Royal Marines in his final public engagement before he retires from royal duties. The 96-year-old   in May, after decades of supporting the Queen, as well as attending events for his own charities and organisations.  Prince Philip has completed 22,219 solo engagements since 1952.  On Wednesday, he will meet servicemen who have taken part in a 1,664-mile trek in aid of charity. As Captain General of the Royal Marines, the duke will attend a parade to mark the finale of the 1664 Global Challenge - a series of strength and endurance challenges raising funds and awareness for charity. While his diary of engagements will come to an end, Buckingham Palace has said the Duke may still decide to attend certain events alongside the Queen in the future.  The Queen's public schedule will continue as normal.  On announcing his retirement earlier this year, the royal consort was praised for his years of service, with prime minister Theresa May offering the country's ""deepest gratitude and good wishes"". Labour leader Jeremy Corbyn wished him ""all the best in his well-earned retirement""."
"More than a million women in their early 60s have become poorer as a result of delays to their state pensions, according to a new study.",2 August 2017,"Older women poorer after pension age change, says IFS",http://www.bbc.co.uk/news/business-40791216,https://ichef-1.bbci.co.uk/news/320/cpsprodpb/1538D/production/_97152968_mediaitem97152967.jpg,"More than a million women in their early 60s have become poorer as a result of delays to their state pensions, according to a new study. Researchers at the Institute for Fiscal Studies (IFS) found that, on average, women aged between 60 and 62 were now £32 a week worse off. As a result poverty rates among that group have risen sharply, it said. But the IFS also said the savings, and extra tax from working women, meant the state was £5.1bn a year better off. Public sector debt   and the government borrowed £46.2bn in the past financial year. The government said its pensions policy was ""fair and sustainable"" and matched continuing rises in life expectancy.  However, the campaign group WASPI (Women Against State Pension Age Inequality) said the research was shocking. ""Once again, this shows that the government has implemented state pension age (SPA) reforms without adequately considering the full impact of these changes on the women affected,"" said WASPI director, Jane Cowley.  ""Whether it is the 3.5 million WASPI women who were not given sufficient warning of rises to their state pension age, or the sharp rise in income poverty among 60 to 62-year-old women, the government needs to sit up and start realising that its changes have devastating consequences on the women affected."" The IFS study showed that many women in the age group already affected by the pension change have continued working.  But the effect of waiting longer for their state pension has, on average, outweighed the gains made by those who have continued to earn a salary. Thus the female 60-62 age group as a whole was earning an extra £2.5bn a year, an average of £44 per week. But the same group has also lost £4.2bn in pension and other benefits per year, or £74 per week. Jonathan Cribb, of the IFS, said the new policy was clearly putting pressure on the budgets of some households. ""The increased state pension age is boosting employment - and therefore earnings - of affected women but this is only partially offsetting reduced incomes from state pensions and other benefits,"" he said.  ""Since both rich and poor women are losing out by, on average, roughly similar amounts the reform increases income poverty rates among households containing a woman who has reached age 60 but has not yet reached her state pension age.""  Looking at the worst affected individuals, the IFS calculated that absolute poverty rates - measured after housing costs - had increased from 15% of women aged between 60 and 62 to 21% of them.   It said there was no evidence that any of the women were in fact experiencing ""material deprivation"" -that is, people saying they cannot afford a range of important items.  Such families may have ""smoothed"" their spending over time, the researchers suggested. Caroline Abrahams, at the charity Age UK, said the IFS figures were ""extremely worrying"". ""While it may have encouraged a number to work longer, many women in their sixties were simply not aware of the rise in SPA and, as was predicted by experts, they have either had too little time to make adequate preparations or have been unable to continue working due to ill health, caring responsibilities or unemployment,"" she said.  But the changes have boosted the government finances. The IFS said that the savings to the public purse had been boosted by the extra income tax and national insurance payments from those women continuing to work, which meant the government's total saving was now running at £5.1bn per year. The study said there was also an effect on single men in their early 60s, who used to be able to claim pension credit.  Under the rules, eligibility for pension credit is also being pushed back. As a result, single men aged 60 to 62 are on average £21 a week worse off, the study suggests. The long-standing policy of equalising women's state pension age with that of men, and then raising it for both groups, has become increasingly controversial. The decision to   was first made back in 1995. Many women who are being affected say they were never made aware of the changes, which have now come as a shock to them. The process kicked off in 2010, with the plan to raise the SPA steadily from age 60 to 65 by the year 2020. But then in 2011 the government decided to accelerate the policy. The SPA will thus be equalised at 65 two years earlier in 2018, and then rise by another year to 66, by 2020. Further increases to 67 and even 68 are in the pipeline. With the process still under way, women currently qualify for their state pension at nearly 64. A spokesman for the Department of Work and Pensions said: ""More people are in work than ever before, including a record 9.9 million older workers. ""Women retiring today can still expect to receive the state pension for over 24.5 years on average - which is more than any generation before them and several years longer than men."""
"A Battle of Britain pilot who once told off the Duke of Cambridge for ""flying choppers"" has died at the age of 99.",1 August 2017,Battle of Britain pilot Kenneth Wilkinson dies aged 99,http://www.bbc.co.uk/news/uk-england-birmingham-40791988,https://ichef-1.bbci.co.uk/news/320/cpsprodpb/5D07/production/_97151832_040536946.jpg,"A Battle of Britain pilot who once told off the Duke of Cambridge for ""flying choppers"" has died at the age of 99. The Battle of Britain Memorial Trust said it was with great sadness that it announced the death of Flying Officer Kenneth Astill Wilkinson AE. Mr Wilkinson, of Solihull, West Midlands, was ""a true gentleman"", the statement added. Battle of Britain pilots were dubbed ""the few"" by wartime leader Winston Churchill. Mr Wilkinson once   for ""flying choppers instead of proper aeroplanes"". The light-hearted comments came during an event to mark the 75th anniversary of the Battle of Britain in 2015. Mr Wilkinson leaves a daughter, Penny, and a grandson, Piers. The Battle of Britain Memorial Trust said he had been an active member of the Battle of Britain Fighter Association (BBFA). ""We shall miss him dearly,"" it added. Retired group captain Patrick Tootal said Mr Wilkinson was ""one of the first to join the BBFA in 1958"". ""It was for all the navigators and pilots. He was one of the most junior members having joined us later on in the war,"" he added. ""He always had a twinkle in his eye, and he liked a glass of red wine. We would always have a joke about it."" He said there were ten members left in the association, ranging from the age of 95 to 99. The Battle of Britain has become known as a turning point for Britain during World War Two when, in 1940, Germany launched an attack on Britain's sea defences. The RAF withstood the attack and Germany called off its invasion plans."
"British Gas will increase electricity prices by 12.5% from 15 September, its owner Centrica has said, in a move that will affect 3.1 million customers.",1 August 2017,British Gas to raise electricity prices,http://www.bbc.co.uk/news/business-40787555,https://ichef.bbci.co.uk/news/320/cpsprodpb/CDD6/production/_97149625_gettyimages-469777200.jpg,"British Gas will increase electricity prices by 12.5% from 15 September, its owner Centrica has said, in a move that will affect 3.1 million customers. Gas prices are unchanged, but the average annual dual-fuel bill for a typical household on a standard tariff will rise by £76 to £1,120, up by 7.3%. Centrica said the rise was a result of transmission and distribution costs and the costs of government policy. But the government said its policy costs ""could not explain"" the rises. Centrica said the price increase was its first since November 2013, adding that British Gas was one of the last suppliers to raise prices. The company said it would protect its most ""vulnerable customers"" against the rise and that British Gas would credit more than 200,000 people on the government's Warm Home Discount with £76. Centrica chief executive Iain Conn told the   that wholesale costs had gone down and were not the reason for the price rise. ""We have seen our wholesale costs fall by about £36 on the typical bill since the beginning of 2014 and that is not the driver. It is transmission and distribution of electricity to the home and government policy costs that are driving our price increase."" He added: ""We are selling electricity at a loss and that is not sustainable."" British Gas had frozen its gas and electricity prices for six months in February, saying at the time it was able to do so by cutting costs to offset higher wholesale prices. A spokeswoman for the Department for Business, Energy and Industrial Strategy said: ""Energy firms should treat all their customers fairly and we're concerned this price rise will hit many people already on poor value tariffs. ""Government policy costs make up a relatively small proportion of household energy bills and cannot explain these price rises."" ""In response to a letter from the Business and Energy Secretary asking what action the regulator intended to take to safeguard customers on the poorest value tariffs and the future of the standard variable tariff, Ofgem has committed to taking prompt action, in consultation with consumer experts, to develop proposals including a safeguard tariff. ""We want to see rapid progress on this commitment."" Alex Neill of Which? magazine urged British Gas customers on the standard variable tariff deal to switch to another provider immediately. ""For the customers of British Gas, they won't really care about any of this squabbling about who's to blame for the costs or the price rises,"" she said.  ""At the end of the day, these people are now paying another £76 on top of what is already more than £1,000 a year for a bill. And they're not really seeing the difference in value that they are getting from British Gas for that £76."" Centrica tried to land the blame for higher bills partly on the government's doormat, but the government wasn't having it. Renewable targets, smart meter rollout, subsidies for insulation and other social and environmental policies were a big factor driving prices higher. The government abandoned a manifesto promise to cap energy bills and instead threw this perennially hot potato to the regulator Ofgem, which is currently consulting on what action to take.  Umpteen probes, competition reviews, promises or threats of caps or nationalisation - the problem of what to do about energy remains as thorny as ever.  The government has reiterated its position that it is not ruling anything out - either by regulation or legislation. That means that although it's on the back-burner for now, an energy price cap is still officially an option. Shadow energy minister Alan Whitehead told   that he believed the government should have acted on its pre-election promise of imposing a price cap on energy costs. ""It is really important now that energy prices are stabilised and we need a cap to do that,"" he said. ""We also need action on the make-up of the customer base of energy companies. It clearly is not sustainable as far as customers are concerned being on mainly these standard variable tariffs, which land the greatest cost on the customers who can least bear it on a regular basis."" Former Liberal Democrat leader Tim Farron said: ""This is a colossal increase that will really hurt customers already struggling with rising prices due to the deteriorating economic situation. ""As a former public utility, British Gas has a huge number of customers who don't switch and is clearly treating these people like cash cows. ""We need to open up the market to more competition to drive down prices and take action to help lower income families. As things stand, there will be a lot of people in fuel poverty this winter shivering in homes they cannot afford to heat or even light."" Centrica Consumer chief executive Mark Hodges said: ""We held off increasing prices for many months longer than most suppliers in order to protect our customers from rising costs, so it is a difficult decision to have to announce an increase in electricity prices."" The company added that 5.3 million of its customers would be unaffected by the rise. The news came as Centrica's half-year results revealed that it lost 377,000 customer accounts in the first half of 2017, with its consumer earnings dropping by more than a quarter as a result. Underlying operating profits from its UK home energy supply arm fell 26% to £381m as the group said it was also hit by warmer than normal temperatures and the pre-payment tariff cap. Centrica's overall underlying operating profits were 4% lower at £816m for the six months to 30 June. Please include a contact number if you are willing to speak to a BBC journalist. You can also contact us in the following ways: Or use the form below"
